<?xml version="1.0" encoding="UTF-8"?>

<!DOCTYPE people-configuration SYSTEM "conf/dtd/people.dtd">
<!--
1. EMU: Extravehicular Activity Suit Systems Design How to Walk, Talk, and Breathe on Mars
http://www.lpi.usra.edu/publications/reports/CB-979/cornell.pdf
 -->

<people-configuration>

	<!-- The metabolic load or the average amount of oxygen (kg) breathed by a person on each Martian Sol -->
	<!-- Previously called oxygen-consumption-rate -->

	<!-- Total surface requirement for a crew of 3 during a 500-day surface stay based on 
	nominal	activity is ~1260 kg of O2-->
	
	<low-activity-metaboic-load-o2-consumption-rate value="0.78" />
	<nominal-activity-metaboic-load-o2-consumption-rate value="0.84" />
	<high-activity-metaboic-load-o2-consumption-rate value="0.96" />
	
	
	<!-- The normal average amount of water (kg) drank by a person on each Martian Sol -->
	<!-- Default: 4.0 -->
	<water-consumption-rate value="4.0" />

	<!-- The normal average amount (kg) of water usage (cleaning, shower, toilet, etc.) by a person each Martian Sol -->
	<!-- This compares with ~288 kg water usage per person per day in US-->
	<!-- Note : 1 US gallon = 3.79 kg or liter (water)-->
	<!-- Instead of consuming an average of 50 liters to take a shower (typical on Earth), denizens of the ISS uses < 4 liters to bathe. -->
	<!-- Default: 26.0 -->
	<water-usage-rate value="26.0" />

	<!-- The fictitious ratio denoting the amount of grey water and black water generated per unit water usage-->
	<!-- Default: 4.0. This translates to 80% grey water and 20% black water (OR 4 to 1) -->
	<grey-to-black-water-ratio value="4.0" />

	<!-- The normal average amount of dessert (kg) in dry weight eaten by a person on each Martian Sol -->
	<!-- Default: 0.3 dry Weight (arbitrary), note that beverage has arbitrary predefined weight-->
	<dessert-consumption-rate value="0.3" />

	<!-- The normal average amount of food (kg) in dry weight eaten by a person on each Martian Sol -->
	<!-- Default: 0.62 dry Weight -->
	<food-consumption-rate value="0.62" />

	<!-- TODO: account for carbohydrates & protein content
	(1). http://settlement.arc.nasa.gov/75SummerStudy/Chapt3.html#Food
		A heavy workload requires about 3000 Cal/day...consist of 2000 g of water, 470 g dry weight of various carbohydrates and fats,
		60 to 70 g dry weight of proteins, and adequate quantities of various minerals and vitamins
	(2). http://settlement.arc.nasa.gov/Contest/Results/96/winner/seis.html#HUMAN
			Food solids: 0.62Kg ,  Water in food: 1.15Kg
	(3). Food energy per mass: http://en.wiki2.org/wiki/Food_energy
		a. Fats and ethanol have 37 and 29 kJ/g (8.8 and 6.9 kcal/g)
	    b. Proteins and most carbohydrates have about 17 kJ/g (4.1 kcal/g)
		c. Notes:
		1. Each meal is 0.62kg / 4
		2. Assume a daily intake of:
			0.1 kg of fats,
			0.4 kg of proteins and carbo,
			0.12 of fibers and others,

			Daily intake :	.1 * 1000 * 33 kJ + .4 * 1000 * 17 kJ + ... = 10100 kJ or 2415.2 kcal

			Each meal has 0.1550 kg or  2525 kJ
			1 kg ==> 16290.323 kJ

		FOOD_COMPOSITION_ENERGY_RATIO = 16290.323


	(4). A standard conversion in the Systeme Internation de'Unites is that one calorie equals 4.186 joules,
		 which is how much energy is given off in heat to raise 1 kg of water 1 degree Celsius.

			4.186 J = 1 cal		OR 4.186 kJ = 1 Cal or 1 kcal

		a). 1 small kilocalorie (kcal) is equal to 1 large food calorie (Cal):
			1 kcal = 1 Cal
		b). 1 small kilocalorie (kcal) is equal to 1000 small calories (cal):
			1 kcal = 1000 cal

	-->

	<!-- Number of millisols a person can survive without oxygen -->
	<!-- Note: 1 millisol = 88.77 seconds -->
	<!-- Default: 3.38 -->
	<oxygen-deprivation-time value="3.38" />

	<!-- Number of sols a person can survive without water -->
	<!-- Default: 6.0 -->
	<water-deprivation-time value="6.0" />

	<!-- Number of sols a person can survive without food -->
	<!-- Default: 21.0 -->
	<food-deprivation-time value="21.0" />

	<!-- Number of sols a person can go without food before starvation sets in -->
	<!-- Default: 3.0 -->
	<starvation-start-time value="3.0" />

	<!-- Minimum air pressure (Pa) a person can withstand without harm -->
	<!-- Default: 25331.25 -->
	<min-air-pressure value="25331.25" />

	<!-- Number of millisols a person can survive in decompression -->
	<!-- Note: 1 millisol = 88.77 seconds -->
	<!-- Default: 1.0 -->
	<decompression-time value="1.0" />

	<!-- Minimum temperature (degrees celsius) a person can withstand without harm -->
	<!-- Default: 0 degrees celsius -->
	<min-temperature value="0.0" />

	<!-- Maximum temperature (degrees celsius) a person can withstand without harm -->
	<!-- Default: 48 degrees celsius -->
	<max-temperature value="48.0" />

	<!-- Number of millisols a person can survive below minimum temperature -->
	<!-- Note: 1 millisol = 88.77 seconds -->
	<!-- Default: 160.0 -->
	<freezing-time value="160.0" />

	<!-- Base percent chance per millisol that a person at high stress will have a panic attack or depression. -->
	<!-- See medical complaint: "Panic Attack" and "Depression" in medical.xml. -->
	<!-- Default: 10 [in percentage] -->
	<stress-breakdown-chance value="10.0" />

	<!-- Base percent chance per millisol that a person at high fatigue will collapse. -->
	<!-- See medical complaint: "High Fatigue Collapse" in medical.xml. -->
	<!-- Default: 10 [in percentage]  -->
	<high-fatigue-collapse-chance value="10.0" />

	<!-- The average percentage of males to total population in the simulation. -->
	<!-- Default 50 (equal numbers of males and females) -->
	<gender-male-percentage value="50.0" />

	<!-- Myers-Briggs Type Indicator: http://www.wikipedia.org/wiki/MBTI -->
	<!-- TODO: Find statistics appropriate for Martian settlers, perhaps from personality studies of scientists, -->
	<!-- engineers or computer programmers. -->
	<!-- The Proposed average percentages of the 16 MBTI among settlers are as follows -->
	<personality-types>
	<!-- Note: The total percentage for all personality types must equal 100%. -->
		<mbti type="ISTP" percentage="3.0" />
		<mbti type="ISTJ" percentage="19.0" />
		<mbti type="ISFP" percentage="2.0" />
		<mbti type="ISFJ" percentage="8.0" />
		<mbti type="INTP" percentage="6.0" />
		<mbti type="INTJ" percentage="7.0" />
		<mbti type="INFP" percentage="6.0" />
		<mbti type="INFJ" percentage="5.0" />
		<mbti type="ESTP" percentage="2.0" />
		<mbti type="ESTJ" percentage="13.0" />
		<mbti type="ESFP" percentage="2.0" />
		<mbti type="ESFJ" percentage="8.0" />
		<mbti type="ENTP" percentage="4.0" />
		<mbti type="ENTJ" percentage="3.0" />
		<mbti type="ENFP" percentage="7.0" />
		<mbti type="ENFJ" percentage="5.0" />
	</personality-types>

	<!-- List of person names -->
	<person-name-list>

		<person-name value="Aaron Wolfe" gender="male" sponsor="Mars Society (MS)"/>
		<person-name value="Adelina Shaneyfelt" gender="female" sponsor="Mars Society (MS)" />
		<person-name value="Adrian Chan" gender="male" sponsor="Mars Society (MS)" />
		<person-name value="Aki Sashava" gender="female" sponsor="Mars Society (MS)" />
		<person-name value="Al Haldemann" gender="male" sponsor="Mars Society (MS)" />
		<person-name value="Alene Spagnola" gender="female" sponsor="Mars Society (MS)" />
		<person-name value="Alessandra Kucharski" gender="female" sponsor="Mars Society (MS)" />
		<person-name value="Alex Krol" gender="male" sponsor="Mars Society (MS)" />
		<person-name value="Alexandria Luciano" gender="female" sponsor="Mars Society (MS)" />
		<person-name value="Alison Tom" gender="female" sponsor="Mars Society (MS)" />
		<person-name value="Allan Schwister" gender="male" sponsor="Mars Society (MS)" />
		<person-name value="Allison Nowakowski" gender="female" sponsor="Mars Society (MS)" />
		<person-name value="Alvina Hosack" gender="female" sponsor="Mars Society (MS)" />
		<person-name value="Amy Lentz" gender="female" sponsor="Mars Society (MS)" />
		<person-name value="Anna Harmon" gender="female" sponsor="Mars Society (MS)" />
		<person-name value="Anson Nichols" gender="male" sponsor="Mars Society (MS)" />
		<person-name value="Anthony Holmgren" gender="male" sponsor="Mars Society (MS)" />
		<person-name value="Barb Follman" gender="female" sponsor="Mars Society (MS)" />
		<person-name value="Barry Evans" gender="male" sponsor="Mars Society (MS)" />
		<person-name value="Bella Rollie" gender="female" sponsor="Mars Society (MS)" />
		<person-name value="Beth Miller" gender="female" sponsor="Mars Society (MS)" />
		<person-name value="Beth Wilkins" gender="female" sponsor="Mars Society (MS)" />
		<person-name value="Bill Hensley" gender="male" sponsor="Mars Society (MS)" />
		<person-name value="Bill Krushas" gender="male" sponsor="Mars Society (MS)" />
		<person-name value="Boris Debic" gender="male" sponsor="Mars Society (MS)" />
		<person-name value="Brian Cody" gender="male" sponsor="Mars Society (MS)" />
		<person-name value="Brian Donovan" gender="male" sponsor="Mars Society (MS)" />
		<person-name value="Bruce Franke" gender="male" sponsor="Mars Society (MS)" />
		<person-name value="Candida Brandner" gender="female" sponsor="Mars Society (MS)" />
		<person-name value="Carla Deprey" gender="female" sponsor="Mars Society (MS)" />
		<person-name value="Carlita Voytek" gender="female" sponsor="Mars Society (MS)" />
		<person-name value="Cathrine Boria" gender="female" sponsor="Mars Society (MS)" />
		<person-name value="Cathrine Crafford" gender="female" sponsor="Mars Society (MS)" />
		<person-name value="Cathrine Troop" gender="female" sponsor="Mars Society (MS)" />
		<person-name value="Chamal Perera" gender="male" sponsor="Mars Society (MS)" />
		<person-name value="Charla Padmore" gender="female" sponsor="Mars Society (MS)" />
		<person-name value="Charles Emery" gender="male" sponsor="Mars Society (MS)" />
		<person-name value="Charles Kwiatkowski" gender="male" sponsor="Mars Society (MS)" />
		<person-name value="Charlie Elston" gender="male" sponsor="Mars Society (MS)" />